{
  "schema_version": "1.0.0",
  "artifact_id": "70000000-0000-4000-8000-000000000001",
  "execution_id": "40000000-0000-4000-8000-000000000002",
  "artifact_type": "raw_result",
  "media_type": "application/json",
  "size_bytes": 1024,
  "sha256": "cccccccccccccccccccccccccccccccccccccccccccccccccccccccccccccccc",
  "created_at": "2026-07-12T12:02:00Z",
  "idempotency_key": "70000000-0000-4000-8000-000000000002"
}
